{
  "jobId": "job_fixture",
  "organizationId": "org_fixture",
  "companyId": null,
  "bidId": "bid_fixture",
  "documentId": "doc_fixture_nit",
  "status": "COMPLETED",
  "items": [
    {
      "itemKey": "cl_98ae4b3a1f1c3c483ed70520",
      "category": "FINANCIAL",
      "title": "Earnest Money Deposit",
      "description": "Deposit EMD of Rs 7,500 online; without it the bid is rejected.",
      "executionRules": {
        "stampPaperRequired": null,
        "stampPaperDenominationInr": null,
        "notarizationRequired": null,
        "signingAuthorityRank": null,
        "udinRequired": null,
        "apostilleRequired": null,
        "clientCountersignRequired": null
      },
      "attributes": {
        "obligationType": "FINANCIAL_COMMITMENT",
        "action": "UNDERTAKE",
        "stage": "WITH_BID_ONLINE",
        "parties": [],
        "mandatory": "MANDATORY",
        "disqualifying": true,
        "deadline": null,
        "amount": {
          "inr": 7500.0,
          "percent": null,
          "basis": null
        },
        "formRef": null
      },
      "provenance": {
        "sourceDocumentId": "doc_fixture_nit",
        "sourceFileName": "Fixture_NIT_2026.pdf",
        "pageNumber": 1,
        "supportingPages": [],
        "clauseReference": "2.1",
        "sourceBlockId": "chk_doc_fixture_nit_p1",
        "verbatimQuote": "The bidder shall deposit Earnest Money of Rs. 7,500 through online payment, failing which the bid shall be rejected.",
        "confidenceScore": 1.0
      },
      "verificationStatus": "VERIFIED",
      "docOrder": 0,
      "flags": [
        "CONFLICT"
      ]
    },
    {
      "itemKey": "cl_7711bf446e8445b7c6982f60",
      "category": "LEGAL",
      "title": "Physical originals deadline",
      "description": "Originals of bid security and power of attorney must reach by 28 Nov 2026 11:00.",
      "executionRules": {
        "stampPaperRequired": null,
        "stampPaperDenominationInr": null,
        "notarizationRequired": null,
        "signingAuthorityRank": null,
        "udinRequired": null,
        "apostilleRequired": null,
        "clientCountersignRequired": null
      },
      "attributes": {
        "obligationType": "DEADLINE",
        "action": "ATTACH_DOCUMENT",
        "stage": "WITH_BID_PHYSICAL",
        "parties": [],
        "mandatory": "MANDATORY",
        "disqualifying": true,
        "deadline": {
          "kind": "ABSOLUTE",
          "date": "28.11.2026 11:00",
          "anchor": null,
          "offsetDays": null
        },
        "amount": null,
        "formRef": null
      },
      "provenance": {
        "sourceDocumentId": "doc_fixture_nit",
        "sourceFileName": "Fixture_NIT_2026.pdf",
        "pageNumber": 1,
        "supportingPages": [],
        "clauseReference": "3.1",
        "sourceBlockId": "chk_doc_fixture_nit_p2",
        "verbatimQuote": "The original Bid Security and Power of Attorney shall be submitted so as to reach the Authority on or before 11:00 hours on 28.11.2026, failing which the Bid shall be rejected.",
        "confidenceScore": 0.8
      },
      "verificationStatus": "VERIFIED",
      "docOrder": 1,
      "flags": []
    },
    {
      "itemKey": "cl_f24c2117c42a85fe8c48e3c6",
      "category": "FINANCIAL",
      "title": "Performance Security",
      "description": "Furnish performance security of 5% of contract value within 30 days of LOA.",
      "executionRules": {
        "stampPaperRequired": null,
        "stampPaperDenominationInr": null,
        "notarizationRequired": null,
        "signingAuthorityRank": null,
        "udinRequired": null,
        "apostilleRequired": null,
        "clientCountersignRequired": null
      },
      "attributes": {
        "obligationType": "FINANCIAL_COMMITMENT",
        "action": null,
        "stage": "POST_AWARD",
        "parties": [
          "BANK"
        ],
        "mandatory": "MANDATORY",
        "disqualifying": null,
        "deadline": {
          "kind": "RELATIVE",
          "date": null,
          "anchor": "LOA",
          "offsetDays": 30
        },
        "amount": {
          "inr": null,
          "percent": 5.0,
          "basis": "contract value"
        },
        "formRef": null
      },
      "provenance": {
        "sourceDocumentId": "doc_fixture_nit",
        "sourceFileName": "Fixture_NIT_2026.pdf",
        "pageNumber": 2,
        "supportingPages": [],
        "clauseReference": "4.1",
        "sourceBlockId": "chk_doc_fixture_nit_p3",
        "verbatimQuote": "The successful bidder shall furnish a Performance Security of 5% of the contract value within 30 days of issue of the Letter of Acceptance.",
        "confidenceScore": 1.0
      },
      "verificationStatus": "VERIFIED",
      "docOrder": 2,
      "flags": [
        "CONFLICT"
      ]
    },
    {
      "itemKey": "cl_9fa5d1c01124f88e0e1166ed",
      "category": "FINANCIAL",
      "title": "Earnest Money amount",
      "description": "EMD is Rs 12,500 (2.5% of estimated value).",
      "executionRules": {
        "stampPaperRequired": null,
        "stampPaperDenominationInr": null,
        "notarizationRequired": null,
        "signingAuthorityRank": null,
        "udinRequired": null,
        "apostilleRequired": null,
        "clientCountersignRequired": null
      },
      "attributes": {
        "obligationType": "FINANCIAL_COMMITMENT",
        "action": null,
        "stage": null,
        "parties": [],
        "mandatory": "MANDATORY",
        "disqualifying": null,
        "deadline": null,
        "amount": {
          "inr": 12500.0,
          "percent": 2.5,
          "basis": "estimated value"
        },
        "formRef": null
      },
      "provenance": {
        "sourceDocumentId": "doc_fixture_nit",
        "sourceFileName": "Fixture_NIT_2026.pdf",
        "pageNumber": 3,
        "supportingPages": [],
        "clauseReference": "A1.1",
        "sourceBlockId": "chk_doc_fixture_nit_p4",
        "verbatimQuote": "The Earnest Money shall be Rs. 12,500, being 2.5% of the estimated value.",
        "confidenceScore": 0.85
      },
      "verificationStatus": "VERIFIED",
      "docOrder": 3,
      "flags": [
        "CONFLICT"
      ]
    },
    {
      "itemKey": "cl_03b56a14d0ef09f275707cde",
      "category": "LEGAL",
      "title": "Non-blacklisting affidavit",
      "description": "Affidavit on Rs 10 stamp paper, notarised, that the bidder is not blacklisted.",
      "executionRules": {
        "stampPaperRequired": true,
        "stampPaperDenominationInr": 10,
        "notarizationRequired": true,
        "signingAuthorityRank": null,
        "udinRequired": null,
        "apostilleRequired": null,
        "clientCountersignRequired": null
      },
      "attributes": {
        "obligationType": "DOCUMENT",
        "action": "ATTACH_DOCUMENT",
        "stage": "WITH_BID_PHYSICAL",
        "parties": [
          "NOTARY"
        ],
        "mandatory": "MANDATORY",
        "disqualifying": null,
        "deadline": null,
        "amount": null,
        "formRef": null
      },
      "provenance": {
        "sourceDocumentId": "doc_fixture_nit",
        "sourceFileName": "Fixture_NIT_2026.pdf",
        "pageNumber": 3,
        "supportingPages": [],
        "clauseReference": "A1.2",
        "sourceBlockId": "chk_doc_fixture_nit_p4",
        "verbatimQuote": "An affidavit on non-judicial stamp paper of Rs. 10, duly notarised, shall be furnished stating that the bidder is not blacklisted.",
        "confidenceScore": 0.85
      },
      "verificationStatus": "VERIFIED",
      "docOrder": 4,
      "flags": []
    },
    {
      "itemKey": "cl_49e67f5a8636c6adfee61e22",
      "category": "FINANCIAL",
      "title": "Turnover certificate with UDIN",
      "description": "Statutory auditor certifies turnover in Appendix XI format with UDIN.",
      "executionRules": {
        "stampPaperRequired": null,
        "stampPaperDenominationInr": null,
        "notarizationRequired": null,
        "signingAuthorityRank": null,
        "udinRequired": true,
        "apostilleRequired": null,
        "clientCountersignRequired": null
      },
      "attributes": {
        "obligationType": "DOCUMENT",
        "action": "ATTACH_DOCUMENT",
        "stage": null,
        "parties": [
          "CA_AUDITOR"
        ],
        "mandatory": "MANDATORY",
        "disqualifying": null,
        "deadline": null,
        "amount": null,
        "formRef": "Appendix XI"
      },
      "provenance": {
        "sourceDocumentId": "doc_fixture_nit",
        "sourceFileName": "Fixture_NIT_2026.pdf",
        "pageNumber": 3,
        "supportingPages": [],
        "clauseReference": "A1.3",
        "sourceBlockId": "chk_doc_fixture_nit_p4",
        "verbatimQuote": "The turnover certificate shall be issued by the statutory auditor in the format at Appendix XI with UDIN.",
        "confidenceScore": 0.85
      },
      "verificationStatus": "VERIFIED",
      "docOrder": 5,
      "flags": []
    },
    {
      "itemKey": "cl_5287b0cbc80cbdb154204a66",
      "category": "FINANCIAL",
      "title": "Performance Security",
      "description": "Furnish performance security of 3% of contract value.",
      "executionRules": {
        "stampPaperRequired": null,
        "stampPaperDenominationInr": null,
        "notarizationRequired": null,
        "signingAuthorityRank": null,
        "udinRequired": null,
        "apostilleRequired": null,
        "clientCountersignRequired": null
      },
      "attributes": {
        "obligationType": "FINANCIAL_COMMITMENT",
        "action": null,
        "stage": null,
        "parties": [],
        "mandatory": "MANDATORY",
        "disqualifying": null,
        "deadline": null,
        "amount": {
          "inr": null,
          "percent": 3.0,
          "basis": "contract value"
        },
        "formRef": null
      },
      "provenance": {
        "sourceDocumentId": "doc_fixture_nit",